{
  "v": 1,
  "command": "cleanup",
  "success": true,
  "provider": "",
  "model": "",
  "language": "",
  "transcript_raw": "texte brut",
  "transcript_final": "texte brut",
  "segment_count": 0,
  "segments": [],
  "warnings": [
    {
      "class": "",
      "provider": "",
      "component": "cleanup",
      "message": "cleanup désactivé: entrée conservée sans modification"
    }
  ],
  "error": null
}
